{
  "schema_version": "0.1.0",
  "policy_check_id": "policy-check-needs-approval-001",
  "actor_id": "actor-synthetic-lawyer-001",
  "resource": {
    "schema_version": "0.1.0",
    "resource_id": "resource-minute-book-resolution-001",
    "resource_type": "minute-book-record",
    "module": "redshieldworks-minute-book",
    "organization_id": "org-synthetic-001",
    "workspace_id": "workspace-synthetic-001",
    "entity_id": "entity-synthetic-001",
    "sensitivity": "confidential",
    "labels": [
      "resolution",
      "share-issuance"
    ]
  },
  "permission": "minute-book:approve",
  "decision": "needs_approval",
  "checked_at": "2026-06-12T12:32:00Z",
  "reason": "Synthetic share issuance approval requires legal action gate.",
  "matched_grant_ids": [
    "permission-grant-lawyer-module-001"
  ],
  "approval_gate": "legal_action",
  "segregation_of_duties": {
    "required": true,
    "conflicting_actor_ids": [
      "actor-synthetic-drafter-001"
    ],
    "rule": "drafter-cannot-be-final-approver"
  },
  "metadata": {
    "synthetic": true
  }
}
