{
  "schema_version": "0.1.0",
  "policy_check_id": "policy-check-allow-001",
  "actor_id": "actor-synthetic-owner-001",
  "resource": {
    "schema_version": "0.1.0",
    "resource_id": "resource-minute-book-record-001",
    "resource_type": "minute-book-record",
    "module": "redshieldworks-minute-book",
    "organization_id": "org-synthetic-001",
    "workspace_id": "workspace-synthetic-001",
    "entity_id": "entity-synthetic-001",
    "sensitivity": "confidential",
    "labels": [
      "minute-book"
    ]
  },
  "permission": "minute-book:read",
  "decision": "allow",
  "checked_at": "2026-06-12T12:30:00Z",
  "reason": "Synthetic owner has read access.",
  "matched_grant_ids": [
    "permission-grant-owner-module-001"
  ],
  "metadata": {
    "synthetic": true
  }
}
